<?xml version="1.0" encoding="UTF-8"?>
<tns:notes xmlns:tns="http://www.example.org/note" xmlns:xsi="http://www.w3.org/2001/XMLSchema-instance" xsi:schemaLocation="http://www.example.org/note note.xsd ">
  <tns:note>
    <tns:title>tns:title</tns:title>
    <tns:from uder-id="idvalue0"/>
    <tns:to user-id="idvalue0"/>
    <tns:message lang="it"/>
  </tns:note>
  <tns:agenda>
    <tns:person email="" id="idvalue0" name="" surname="">
      <tns:description>fddgt<tns:imp></tns:imp>drgtgrg</tns:description>
    </tns:person>
  </tns:agenda>
</tns:notes>
